[
  {
    "customerId": "11111111-1111-1111-1111-111111111111",
    "name": {"first": "Alice", "last": "Smith"},
    "primaryEmail": "alice@example.com",
    "phoneNumbers": [{"label": "mobile", "number": "+14155550001"}],
    "addresses": [
      {
        "addressType": "home",
        "line1": "123 Main St",
        "city": "Austin",
        "state": "TX",
        "postalCode": "78701",
        "country": "US"
      }
    ],
    "status": "ACTIVE",
    "createdAt": "2025-06-05T14:32:11Z",
    "updatedAt": "2025-06-05T14:32:11Z"
  },
  {
    "customerId": "22222222-2222-2222-2222-222222222222",
    "name": {"first": "Bob", "last": "Jones"},
    "primaryEmail": "bob@example.com",
    "phoneNumbers": [{"label": "mobile", "number": "+14155550002"}],
    "addresses": [
      {
        "addressType": "home",
        "line1": "1 Second St",
        "city": "Austin",
        "state": "TX",
        "postalCode": "78701",
        "country": "US"
      }
    ],
    "status": "ACTIVE",
    "createdAt": "2025-06-05T15:00:00Z",
    "updatedAt": "2025-06-05T15:00:00Z"
  }
]
